title,description
Research visa requirements,Research the visa requirements for living and working in the US as a Brazilian software engineer.
Explore job opportunities,Research software architect job opportunities in the San Rose area and identify potential companies to target.
Enhance technical skills,Identify areas for improvement in software architecture and work on enhancing relevant technical skills.
Build a professional network,Join online communities and attend networking events to connect with software professionals in the San Rose area.
Create/update resume,Tailor the resume to highlight relevant experience and skills for software architect positions.
Prepare a cover letter,Draft a compelling cover letter that showcases enthusiasm and qualifications for software architect roles.
Apply for jobs,Start applying to software architect positions in San Rose including submitting applications and resumes.
Save money,Develop a budget plan and savings strategy to save up $10000 for living expenses in San Rose.
Research housing options,Explore different housing options in San Rose and evaluate the cost location and amenities.
Explore healthcare options,Research health insurance plans and healthcare providers in San Rose to ensure adequate coverage.
Prepare for interviews,Review common interview questions and practice answering them confidently.
Arrange for transportation,Research transportation options in San Rose such as public transit or purchasing a car.
Organize documents,Gather and organize important documents required for the visa application process and job interviews.
Research cost of living,Calculate the estimated cost of living in San Rose including rent utilities groceries and transportation.
Prepare for cultural adjustment,Learn about the local culture customs and etiquette in San Rose to facilitate a smooth transition.
Set up a bank account,Research and choose a bank in San Rose to open a bank account for managing finances.
Obtain necessary vaccinations,Consult a healthcare professional to ensure all required vaccinations are up to date.
Create a relocation checklist,Compile a comprehensive checklist of tasks and deadlines for a smooth relocation process.
Arrange for temporary accommodation,Explore temporary accommodation options for the initial period upon arrival in San Rose.
Notify current employer,Inform the current employer about the plans to relocate and resign from the current position.
Obtain necessary documents,Apply for and obtain any required documents such as a work visa or residence permit for living and working in the US.
Book flights,Research flight options and book a flight to San Rose for the planned relocation date.
Transfer funds,Arrange for the transfer of funds from the Brazilian bank account to the newly opened US bank account.
Pack and ship belongings,Decide on what belongings to take and arrange for shipping or storage of remaining items.
Set up utilities,Contact utility providers in San Rose to set up essential services such as electricity. water and internet.
Plan for healthcare,Research healthcare providers and insurance options in San Rose and make necessary arrangements.
Explore social activities,Research local social activities clubs and organizations to meet new people and engage in hobbies.
Attend interviews,Attend scheduled interviews for software architect positions in San Rose and prepare thoroughly.
Evaluate job offers,Evaluate job offers based on factors such as compensation. benefits and career growth opportunities.
Notify current landlord,Inform the current landlord about the plans to move out and coordinate the move-out process.
Book temporary accommodation,Finalize bookings for temporary accommodation during the initial period in San Rose.
Prepare for the move,Create a packing plan and organize necessary logistics for the move to San Rose.
Say goodbye to friends and family,Spend quality time with friends and family before the departure and bid them farewell.
Travel to San Rose,Make necessary travel arrangements and embark on the journey to San Rose to start a new chapter.